{
    "$schema": "./assertion-config.schema.json",
    "version": "1.0.0",
    "activeFramework": "playwright",
    "globalSettings": {
        "defaultTimeout": 30000,
        "retryCount": 3,
        "softAssertionsEnabled": true,
        "screenshotOnFailure": true,
        "customMessagesRequired": true,
        "pollingInterval": [
            100,
            250,
            500,
            1000
        ]
    },
    "frameworks": {
        "playwright": {
            "name": "Playwright",
            "version": "^1.40.0",
            "documentation": "https://playwright.dev/docs/test-assertions",
            "import": {
                "statement": "const { test, expect } = require('@playwright/test');",
                "destructure": [
                    "test",
                    "expect"
                ]
            },
            "assertions": {
                "visibility": {
                    "toBeVisible": {
                        "syntax": "await expect(locator).toBeVisible()",
                        "description": "Asserts element is visible on the page",
                        "autoRetry": true,
                        "parameters": [
                            {
                                "name": "options",
                                "type": "object",
                                "required": false,
                                "description": "{ timeout?: number }"
                            }
                        ],
                        "example": "await expect(page.getByRole('button', { name: 'Submit' })).toBeVisible();",
                        "tags": [
                            "visibility",
                            "ui",
                            "common"
                        ]
                    },
                    "toBeHidden": {
                        "syntax": "await expect(locator).toBeHidden()",
                        "description": "Asserts element is NOT visible (hidden or detached)",
                        "autoRetry": true,
                        "example": "await expect(page.getByTestId('loading-spinner')).toBeHidden();",
                        "tags": [
                            "visibility",
                            "ui"
                        ]
                    },
                    "toBeInViewport": {
                        "syntax": "await expect(locator).toBeInViewport()",
                        "description": "Asserts element is within the viewport (scrolled into view)",
                        "autoRetry": true,
                        "example": "await expect(page.getByRole('heading')).toBeInViewport();",
                        "tags": [
                            "visibility",
                            "viewport",
                            "scroll"
                        ]
                    },
                    "toBeAttached": {
                        "syntax": "await expect(locator).toBeAttached()",
                        "description": "Asserts element exists in DOM (may be hidden)",
                        "autoRetry": true,
                        "example": "await expect(page.locator('#hidden-input')).toBeAttached();",
                        "tags": [
                            "dom",
                            "existence"
                        ]
                    }
                },
                "state": {
                    "toBeEnabled": {
                        "syntax": "await expect(locator).toBeEnabled()",
                        "description": "Asserts element is enabled (not disabled)",
                        "autoRetry": true,
                        "example": "await expect(page.getByRole('button', { name: 'Submit' })).toBeEnabled();",
                        "tags": [
                            "state",
                            "interactive",
                            "common"
                        ]
                    },
                    "toBeDisabled": {
                        "syntax": "await expect(locator).toBeDisabled()",
                        "description": "Asserts element is disabled",
                        "autoRetry": true,
                        "example": "await expect(page.getByRole('button', { name: 'Submit' })).toBeDisabled();",
                        "tags": [
                            "state",
                            "interactive"
                        ]
                    },
                    "toBeChecked": {
                        "syntax": "await expect(locator).toBeChecked()",
                        "description": "Asserts checkbox/radio is checked",
                        "autoRetry": true,
                        "parameters": [
                            {
                                "name": "options",
                                "type": "object",
                                "required": false,
                                "description": "{ checked?: boolean, timeout?: number }"
                            }
                        ],
                        "example": "await expect(page.getByRole('checkbox', { name: 'Terms' })).toBeChecked();",
                        "tags": [
                            "state",
                            "form",
                            "checkbox"
                        ]
                    },
                    "toBeFocused": {
                        "syntax": "await expect(locator).toBeFocused()",
                        "description": "Asserts element has keyboard focus",
                        "autoRetry": true,
                        "example": "await expect(page.getByLabel('Email')).toBeFocused();",
                        "tags": [
                            "state",
                            "focus",
                            "keyboard"
                        ]
                    },
                    "toBeEditable": {
                        "syntax": "await expect(locator).toBeEditable()",
                        "description": "Asserts element is editable (input, textarea, contenteditable)",
                        "autoRetry": true,
                        "example": "await expect(page.getByLabel('Username')).toBeEditable();",
                        "tags": [
                            "state",
                            "form",
                            "input"
                        ]
                    },
                    "toBeEmpty": {
                        "syntax": "await expect(locator).toBeEmpty()",
                        "description": "Asserts element has no children/text content",
                        "autoRetry": true,
                        "example": "await expect(page.getByTestId('results-list')).toBeEmpty();",
                        "tags": [
                            "state",
                            "content"
                        ]
                    }
                },
                "content": {
                    "toHaveText": {
                        "syntax": "await expect(locator).toHaveText(expected)",
                        "description": "Asserts element text matches exactly (with normalization)",
                        "autoRetry": true,
                        "parameters": [
                            {
                                "name": "expected",
                                "type": "string | RegExp | string[]",
                                "required": true,
                                "description": "Expected text or pattern"
                            },
                            {
                                "name": "options",
                                "type": "object",
                                "required": false,
                                "description": "{ ignoreCase?: boolean, timeout?: number, useInnerText?: boolean }"
                            }
                        ],
                        "example": "await expect(page.getByRole('heading')).toHaveText('Welcome');",
                        "tags": [
                            "content",
                            "text",
                            "common"
                        ]
                    },
                    "toContainText": {
                        "syntax": "await expect(locator).toContainText(expected)",
                        "description": "Asserts element contains specified text (partial match)",
                        "autoRetry": true,
                        "parameters": [
                            {
                                "name": "expected",
                                "type": "string | RegExp | string[]",
                                "required": true,
                                "description": "Text to find"
                            }
                        ],
                        "example": "await expect(page.getByRole('alert')).toContainText('Error');",
                        "tags": [
                            "content",
                            "text",
                            "partial",
                            "common"
                        ]
                    },
                    "toHaveValue": {
                        "syntax": "await expect(locator).toHaveValue(expected)",
                        "description": "Asserts input element has specified value",
                        "autoRetry": true,
                        "parameters": [
                            {
                                "name": "expected",
                                "type": "string | RegExp",
                                "required": true,
                                "description": "Expected input value"
                            }
                        ],
                        "example": "await expect(page.getByLabel('Email')).toHaveValue('test@example.com');",
                        "tags": [
                            "content",
                            "form",